ID,Name,Description,Tags
1,Kelly,"Avid reader of English literature and History, enjoys Geography field trips","['English', 'History', 'Geography']"
2,Olivia,"Excels in Math competitions, passionate about Science experiments","['Math', 'Science']"
3,Noah,"Enjoys analyzing historical events, participates in Geography quizzes",['Geography']
4,Liam,"Sports enthusiast, particularly interested in Sports Science",['Sports']
5,Maya,Balances Math problem-solving with English poetry appreciation,"['Math', 'English']"
